{
  "$schema": "https://json-schema.org/draft/2020-12/schema",
  "$id": "https://oh-my-stack.invalid/schemas/release-config.schema.json",
  "title": "Oh My Stack release configuration",
  "type": "object",
  "additionalProperties": false,
  "required": ["schemaVersion", "archiveRoot", "pluginBundles", "targets"],
  "properties": {
    "schemaVersion": { "const": 1 },
    "archiveRoot": { "type": "string", "pattern": "^[a-z0-9]+(?:-[a-z0-9]+)*$" },
    "pluginBundles": {
      "type": "array",
      "minItems": 2,
      "maxItems": 2,
      "items": {
        "oneOf": [
        {
        "type": "object",
        "additionalProperties": false,
        "required": ["id", "target", "packageDir", "archiveRoot", "marketplace"],
        "properties": {
          "id": { "const": "codex-marketplace" },
          "target": { "const": "codex" },
          "packageDir": { "const": "packages/codex" },
          "archiveRoot": { "type": "string", "pattern": "^[a-z0-9]+(?:-[a-z0-9]+)*$" },
          "marketplace": {
            "type": "object",
            "additionalProperties": false,
            "required": ["name", "interface", "plugin"],
            "properties": {
              "name": { "type": "string", "pattern": "^[A-Za-z0-9_-]+$" },
              "interface": {
                "type": "object",
                "additionalProperties": false,
                "required": ["displayName"],
                "properties": {
                  "displayName": { "type": "string", "minLength": 1 }
                }
              },
              "plugin": {
                "type": "object",
                "additionalProperties": false,
                "required": ["name", "source", "policy", "category"],
                "properties": {
                  "name": { "type": "string", "pattern": "^[A-Za-z0-9_-]+(?:\\.[A-Za-z0-9_-]+)*$" },
                  "source": {
                    "type": "object",
                    "additionalProperties": false,
                    "required": ["source", "path"],
                    "properties": {
                      "source": { "const": "local" },
                      "path": { "const": "./plugins/oh-my-stack" }
                    }
                  },
                  "policy": {
                    "type": "object",
                    "additionalProperties": false,
                    "required": ["installation", "authentication"],
                    "properties": {
                      "installation": { "enum": ["NOT_AVAILABLE", "AVAILABLE", "INSTALLED_BY_DEFAULT"] },
                      "authentication": { "enum": ["ON_INSTALL", "ON_USE"] }
                    }
                  },
                  "category": { "type": "string", "minLength": 1 }
                }
              }
            }
          }
        }
        },
        {
          "type": "object",
          "additionalProperties": false,
          "required": ["id", "target", "packageDir", "archiveRoot", "marketplace"],
          "properties": {
            "id": { "const": "claude-marketplace" },
            "target": { "const": "claude-code" },
            "packageDir": { "const": "packages/claude-code" },
            "archiveRoot": { "type": "string", "pattern": "^[a-z0-9]+(?:-[a-z0-9]+)*$" },
            "marketplace": {
              "type": "object",
              "additionalProperties": false,
              "required": ["name", "description", "owner", "plugins"],
              "properties": {
                "name": { "type": "string", "pattern": "^[a-z0-9]+(?:-[a-z0-9]+)*$" },
                "description": { "type": "string", "minLength": 1 },
                "owner": {
                  "type": "object",
                  "additionalProperties": false,
                  "required": ["name"],
                  "properties": { "name": { "type": "string", "minLength": 1 } }
                },
                "plugins": {
                  "type": "array",
                  "minItems": 1,
                  "maxItems": 1,
                  "items": {
                    "type": "object",
                    "additionalProperties": false,
                    "required": ["name", "source", "description"],
                    "properties": {
                      "name": { "const": "oh-my-stack" },
                      "source": { "const": "./plugins/oh-my-stack" },
                      "description": { "type": "string", "minLength": 1 }
                    }
                  }
                }
              }
            }
          }
        }
        ]
      }
    },
    "targets": {
      "type": "array",
      "minItems": 1,
      "items": {
        "type": "object",
        "additionalProperties": false,
        "required": ["id", "packageDir", "verification"],
        "properties": {
          "id": { "enum": ["omp", "codex", "claude-code", "pi"] },
          "packageDir": { "type": "string", "pattern": "^packages/" },
          "verification": {
            "type": "object",
            "additionalProperties": false,
            "required": ["static", "discovery", "lifecycle", "endToEnd"],
            "properties": {
              "static": { "$ref": "#/$defs/status" },
              "discovery": { "$ref": "#/$defs/status" },
              "lifecycle": { "$ref": "#/$defs/status" },
              "endToEnd": { "$ref": "#/$defs/status" }
            }
          }
        }
      }
    }
  },
  "$defs": {
    "status": { "enum": ["verified", "deferred", "not-tested"] }
  }
}
