{
  "$schema": "../schemas/release-config.schema.json",
  "schemaVersion": 1,
  "archiveRoot": "oh-my-stack",
  "pluginBundles": [
    {
      "id": "codex-marketplace",
      "target": "codex",
      "packageDir": "packages/codex",
      "archiveRoot": "oh-my-stack-marketplace",
      "marketplace": {
        "name": "oh-my-stack",
        "interface": {
          "displayName": "Oh My Stack"
        },
        "plugin": {
          "name": "oh-my-stack",
          "source": {
            "source": "local",
            "path": "./plugins/oh-my-stack"
          },
          "policy": {
            "installation": "AVAILABLE",
            "authentication": "ON_INSTALL"
          },
          "category": "Productivity"
        }
      }
    },
    {
      "id": "claude-marketplace",
      "target": "claude-code",
      "packageDir": "packages/claude-code",
      "archiveRoot": "oh-my-stack-claude-marketplace",
      "marketplace": {
        "name": "oh-my-stack",
        "description": "Oh My Stack workflows for Claude Code",
        "owner": { "name": "Oh My Stack contributors" },
        "plugins": [
          {
            "name": "oh-my-stack",
            "source": "./plugins/oh-my-stack",
            "description": "Portable, verifiable engineering workflows for Claude Code."
          }
        ]
      }
    }
  ],
  "targets": [
    {
      "id": "omp",
      "packageDir": "packages/omp",
      "verification": {
        "static": "verified",
        "discovery": "verified",
        "lifecycle": "verified",
        "endToEnd": "verified"
      }
    },
    {
      "id": "codex",
      "packageDir": "packages/codex",
      "verification": {
        "static": "verified",
        "discovery": "verified",
        "lifecycle": "verified",
        "endToEnd": "verified"
      }
    },
    {
      "id": "claude-code",
      "packageDir": "packages/claude-code",
      "verification": {
        "static": "verified",
        "discovery": "deferred",
        "lifecycle": "verified",
        "endToEnd": "deferred"
      }
    },
    {
      "id": "pi",
      "packageDir": "packages/pi",
      "verification": {
        "static": "verified",
        "discovery": "deferred",
        "lifecycle": "deferred",
        "endToEnd": "deferred"
      }
    }
  ]
}
